{
  "assurance_level": "L0",
  "authority_basis_claimed": "Synthetic Fixture Authority per synthetic-example-decision template (claimed, not verified).",
  "conditions": "Synthetic fixture conditions text.",
  "confirmation_evidence_ref": {
    "record_digest": "ea4f539561c0ca019aa5240019ca3397fd4710156f7e9daa5ee1261bdcaafd39",
    "record_family": "human_confirmation_evidence",
    "record_id": "chgrconf-799fa3e19ade4b0899f99b3ea8e6b371"
  },
  "contract_version": "CHGR-001/1.0",
  "created_at": "2026-07-23T00:00:00Z",
  "decision_maker_identity_evidence": {
    "captured_at": "2026-07-23T00:00:00Z",
    "evidence_kind": "typed_confirmation_only",
    "identifier": "unavailable"
  },
  "decision_subject": "synthetic-test-subject-001",
  "extensions": {},
  "governing_references": [
    "SYNTHETIC-FIXTURE-001"
  ],
  "integrity_ref": {
    "record_digest": "91ff74b24e94405a8cfaa35a8615e53073fffaccf7ace69df838d49a5a174d91",
    "record_family": "governance_record_integrity",
    "record_id": "chgrintg-cc28c0fac98b4d689f1d4a59fd2f16ff"
  },
  "lifecycle_state": "published",
  "limitations": [
    "This is a synthetic fixture, not a real Human Governance Act."
  ],
  "provenance_ref": {
    "record_digest": "39a905427c8e3e333933c2c2bc31715ee4aeedaf2db530ca43e5e952f38b1323",
    "record_family": "governance_record_provenance",
    "record_id": "chgrprov-29328fe7fe8344a9a2b0f845bfd61578"
  },
  "rationale": "Synthetic fixture rationale text.",
  "record_digest": "d428439d798dd480ca1e0a6c83c80e45958662e1a9de27af521d4f28b17b38bb",
  "record_id": "chgr-5e3344c10643428b8fe9661b0cad89f6",
  "record_type": "human_governance_record",
  "schema_id": "https://pcae.local/schemas/chgr/records/human_governance_record.schema.json",
  "schema_version": "1.1",
  "selected_option_id": "nonexistent_option",
  "template_ref": {
    "template_id": "synthetic-example-decision",
    "version": "1.0"
  }
}
