{
  "assurance_level": "L4",
  "authority_basis_claimed": "Synthetic Fixture Authority per synthetic-example-decision template (claimed, not verified).",
  "conditions": "Synthetic fixture conditions text.",
  "confirmation_evidence_ref": {
    "record_digest": "064f17ba95b198f682a63f2bf897bf93abd6c9f6afb9640c30ccf7854c56ae48",
    "record_family": "human_confirmation_evidence",
    "record_id": "chgrconf-2098b7586f5541e6bba0827418da420c"
  },
  "contract_version": "CHGR-001/1.0",
  "created_at": "2026-07-23T00:00:00Z",
  "decision_maker_identity_evidence": {
    "captured_at": "2026-07-23T00:00:00Z",
    "evidence_kind": "typed_confirmation_only",
    "identifier": "unavailable"
  },
  "decision_subject": "synthetic-test-subject-001",
  "extensions": {},
  "governing_references": [
    "SYNTHETIC-FIXTURE-001"
  ],
  "integrity_ref": {
    "record_digest": "0000000000000000000000000000000000000000000000000000000000000000",
    "record_family": "governance_record_integrity",
    "record_id": "chgrintg-91ea18efba52459bae5803371b3d67eb"
  },
  "lifecycle_state": "published",
  "limitations": [
    "This is a synthetic fixture, not a real Human Governance Act."
  ],
  "provenance_ref": {
    "record_digest": "0000000000000000000000000000000000000000000000000000000000000000",
    "record_family": "governance_record_provenance",
    "record_id": "chgrprov-85109b824c3f4ba585786bf9c038eb78"
  },
  "rationale": "Synthetic fixture rationale text.",
  "record_digest": "536b6b2de9f445b6d6318278f3c8aff93c584487069a30f5ffb625296ea08d9b",
  "record_id": "chgr-17619ac0af704b84bed43ababbba7018",
  "record_type": "human_governance_record",
  "schema_id": "https://pcae.local/schemas/chgr/records/human_governance_record.schema.json",
  "schema_version": "1.1",
  "selected_option_id": "proceed",
  "template_ref": {
    "template_id": "synthetic-example-decision",
    "version": "1.0"
  }
}
