{
  "assurance_level": "L0",
  "authority_basis_claimed": "Synthetic Fixture Authority per synthetic-example-decision template (claimed, not verified).",
  "conditions": "Synthetic fixture conditions text.",
  "confirmation_evidence_ref": {
    "record_digest": "7c9b0e615dada182753796342ec2a71095e1e4f6d05bab658385b290ac8d4dd1",
    "record_family": "human_confirmation_evidence",
    "record_id": "chgrconf-7a4ee58dc1a349efb651724327e72993"
  },
  "contract_version": "CHGR-001/1.0",
  "created_at": "2026-07-23T00:00:00Z",
  "decision_maker_identity_evidence": {
    "captured_at": "2026-07-23T00:00:00Z",
    "evidence_kind": "typed_confirmation_only",
    "identifier": "unavailable"
  },
  "decision_subject": "synthetic-test-subject-001",
  "extensions": {},
  "governing_references": [
    "SYNTHETIC-FIXTURE-001"
  ],
  "integrity_ref": {
    "record_digest": "8d6ffd896495afa9e74cb472c16955bd2ed634ccfc088dd75d3035149c4216ea",
    "record_family": "governance_record_integrity",
    "record_id": "chgrintg-0e89fb4b72194a68be1819146198d410"
  },
  "lifecycle_state": "draft",
  "limitations": [
    "This is a synthetic fixture, not a real Human Governance Act."
  ],
  "provenance_ref": {
    "record_digest": "79b7bf1e70148b16879257aac7745e784ea4c6ba1032544f96cdc94029bd70ee",
    "record_family": "governance_record_provenance",
    "record_id": "chgrprov-e973778c0e2d4e77bdae2b16976f26fa"
  },
  "rationale": "Synthetic fixture rationale text.",
  "record_digest": "ce5cce9212efc6f1635f87aa86434016268594e4dd147eb2328b4d52b5a20a21",
  "record_id": "chgr-1ec3261d83fc4b36a461b440c5736715",
  "record_type": "human_governance_record",
  "schema_id": "https://pcae.local/schemas/chgr/records/human_governance_record.schema.json",
  "schema_version": "1.0",
  "selected_option_id": "proceed",
  "template_ref": {
    "template_id": "synthetic-example-decision",
    "version": "1.0"
  }
}
