{
  "assurance_level": "L0",
  "authority_basis_claimed": "Synthetic Fixture Authority per synthetic-example-decision template (claimed, not verified).",
  "conditions": "Synthetic fixture conditions text.",
  "confirmation_evidence_ref": {
    "record_digest": "d579463cf67df9b1d38108b0dbe40ba2cf93435804082d53c2c60c77b84907af",
    "record_family": "human_confirmation_evidence",
    "record_id": "chgrconf-2dfef818e282404fad6f41d3fee67e5b"
  },
  "contract_version": "CHGR-001/1.0",
  "created_at": "2026-07-23T00:00:00Z",
  "decision_maker_identity_evidence": {
    "captured_at": "2026-07-23T00:00:00Z",
    "evidence_kind": "typed_confirmation_only",
    "identifier": "unavailable"
  },
  "decision_subject": "synthetic-test-subject-001",
  "extensions": {},
  "governing_references": [
    "SYNTHETIC-FIXTURE-001"
  ],
  "integrity_ref": {
    "record_digest": "5499142985db7b0005fef975fff48d4cb561583ec34de5910a239061a9fea18c",
    "record_family": "governance_record_integrity",
    "record_id": "chgrintg-6d6201bf562a4fc8b90369fdea48df51"
  },
  "lifecycle_state": "superseded",
  "limitations": [
    "This is a synthetic fixture, not a real Human Governance Act."
  ],
  "provenance_ref": {
    "record_digest": "338f11d289c4e438a8a4e429d49210b3da4d90b4ad75c55411f2943a1ee2e25c",
    "record_family": "governance_record_provenance",
    "record_id": "chgrprov-66b38cfd083f4ceda1331e39efe6b6ff"
  },
  "rationale": "Synthetic fixture rationale text.",
  "record_digest": "92a4841321fa94a82492a4e5ce3a4ca3b184cea0879d8c55222fe162bb4872d6",
  "record_id": "chgr-5e4e3434b2ab4ed2a226c3e375eef1f9",
  "record_type": "human_governance_record",
  "schema_id": "https://pcae.local/schemas/chgr/records/human_governance_record.schema.json",
  "schema_version": "1.0",
  "selected_option_id": "proceed",
  "template_ref": {
    "template_id": "synthetic-example-decision",
    "version": "1.0"
  }
}
